{
  "id": "teaching-education",
  "name": "Teaching & Education",
  "version": "1.0.0",
  "author": {
    "name": "TextDeck",
    "github": "JHBalane"
  },
  "description": "Lesson plans, explanations, feedback and parent emails — for teachers, trainers and anyone who has to make something land.",
  "category": "productivity",
  "language": "en",
  "regions": [
    "US",
    "GB",
    "DE",
    "AT",
    "CH"
  ],
  "license": "TextDeck-Community-1.0",
  "created": "2026-08-12",
  "updated": "2026-08-12",
  "tags": [
    "teaching",
    "education",
    "training",
    "learning"
  ],
  "prompts": [
    {
      "id": "lesson-plan-with-one-objective",
      "title": "Lesson Plan With One Objective",
      "description": "A single session built backwards from what learners must be able to do",
      "content": "Plan a {{duration}} session on {{subject}} for {{grade_level}}.\n\nObjective: {{learning_objective}}\n\nStructure:\n1. The check at the end that proves the objective was met — write this first\n2. Opening hook, 5 minutes, that surfaces what they already believe\n3. Input — the minimum explanation needed, with the one analogy you would keep\n4. Practice — what learners DO, with the exact task wording\n5. The check from step 1\n6. What to cut if you lose 10 minutes\n\nRules:\n- One objective. If two appear, pick the one the check can measure.\n- Learners must be doing something within the first 12 minutes\n- Name what you will NOT cover and why",
      "variables": [
        {
          "name": "duration",
          "description": "How long the session is",
          "example": "45 minutes",
          "required": true
        },
        {
          "name": "subject",
          "description": "Subject or course",
          "example": "9th-grade chemistry",
          "required": true
        },
        {
          "name": "grade_level",
          "description": "Age or level of the learners",
          "example": "15–16 year olds, mixed ability",
          "required": true
        },
        {
          "name": "learning_objective",
          "description": "What learners should be able to do afterwards",
          "example": "balance simple redox equations",
          "required": true
        }
      ],
      "tags": [
        "teaching",
        "education",
        "training"
      ],
      "difficulty": "beginner"
    },
    {
      "id": "explain-it-three-ways",
      "title": "Explain It Three Ways",
      "description": "Same concept at three depths, so you can switch mid-lesson",
      "content": "Explain {{concept}} to {{grade_level}}.\n\nGive three versions:\n1. One sentence, no jargon\n2. A concrete example from their actual life, worked through step by step\n3. The precise version, with the terms they will meet in exams or at work\n\nThen:\n- The analogy's breaking point — where it stops being true, stated plainly\n- The check question that distinguishes real understanding from repeating words\n\nRules:\n- Never use an analogy without saying where it fails\n- No \"imagine you have 10 apples\" unless the apples do real work in the explanation",
      "variables": [
        {
          "name": "concept",
          "description": "The idea being taught",
          "example": "opportunity cost",
          "required": true
        },
        {
          "name": "grade_level",
          "description": "Age or level of the learners",
          "example": "15–16 year olds, mixed ability",
          "required": true
        }
      ],
      "tags": [
        "teaching",
        "education",
        "training"
      ],
      "difficulty": "beginner"
    },
    {
      "id": "attack-a-misconception",
      "title": "Attack a Misconception",
      "description": "Plan the moment where a wrong idea gets replaced",
      "content": "Learners of {{grade_level}} believe: {{misconception}}\nCorrect understanding: {{concept}}\n\nProduce:\n1. Why the wrong idea is reasonable — state it sympathetically, it usually works in some cases\n2. The exact case where it fails, small enough to demonstrate in class\n3. The demonstration or worked example, step by step\n4. The question that reveals whether the correction stuck — where the old idea would give a different answer\n5. What they will still get wrong next week, and the reminder that fixes it\n\nRules:\n- Never just assert the correct version. Wrong ideas survive contradiction; they die from a failed prediction.",
      "variables": [
        {
          "name": "grade_level",
          "description": "Age or level of the learners",
          "example": "15–16 year olds, mixed ability",
          "required": true
        },
        {
          "name": "misconception",
          "description": "The common mistake to address",
          "example": "that electrons are 'used up'",
          "required": true
        },
        {
          "name": "concept",
          "description": "The idea being taught",
          "example": "opportunity cost",
          "required": true
        }
      ],
      "tags": [
        "teaching",
        "education",
        "training"
      ],
      "difficulty": "advanced"
    },
    {
      "id": "practice-questions-with-rubric",
      "title": "Practice Questions With Rubric",
      "description": "A graded set of exercises plus how to mark them",
      "content": "Write practice questions on {{learning_objective}} for {{grade_level}}.\n\nProduce 8 questions, ordered by difficulty:\n- 3 that check the basic mechanic\n- 3 that apply it in an unfamiliar situation\n- 2 that require combining it with something learned earlier\n\nFor each: the answer, the most likely wrong answer, and what that wrong answer reveals.\n\nThen a 4-level rubric describing what each level looks like in a learner's work.\n\nRules:\n- No trick questions. Difficulty comes from transfer, not from wording.\n- Every question answerable with what was actually taught",
      "variables": [
        {
          "name": "learning_objective",
          "description": "What learners should be able to do afterwards",
          "example": "balance simple redox equations",
          "required": true
        },
        {
          "name": "grade_level",
          "description": "Age or level of the learners",
          "example": "15–16 year olds, mixed ability",
          "required": true
        }
      ],
      "tags": [
        "teaching",
        "education",
        "training"
      ],
      "difficulty": "intermediate"
    },
    {
      "id": "feedback-on-student-work",
      "title": "Feedback on Student Work",
      "description": "Comments a learner can act on before the next attempt",
      "content": "Give feedback on this work from a {{grade_level}} learner.\n\nWork: {{text}}\nObjective: {{learning_objective}}\n\nStructure:\n1. What works, named specifically — quote the line\n2. The single most important thing to change, and why it matters\n3. Exactly how to do it differently — a rewritten example of one part\n4. One question for the learner to answer themselves\n\nRules:\n- One priority. A list of eight fixes gets none of them done.\n- Address the work, never the person (\"this paragraph assumes…\" not \"you always…\")\n- No praise sandwich — learners see through it and discount the praise",
      "variables": [
        {
          "name": "grade_level",
          "description": "Age or level of the learners",
          "example": "15–16 year olds, mixed ability",
          "required": true
        },
        {
          "name": "text",
          "description": "The text to work on",
          "example": "paste your draft here",
          "required": true
        },
        {
          "name": "learning_objective",
          "description": "What learners should be able to do afterwards",
          "example": "balance simple redox equations",
          "required": true
        }
      ],
      "tags": [
        "teaching",
        "education",
        "training"
      ],
      "difficulty": "intermediate"
    },
    {
      "id": "differentiate-one-lesson",
      "title": "Differentiate One Lesson",
      "description": "Adapt a single plan for the range actually in the room",
      "content": "Adapt this lesson for a mixed group: {{context}}\n\nObjective everyone must reach: {{learning_objective}}\n\nProduce:\n1. The core task everyone does\n2. Support version — same task, scaffolded. Name the scaffold and when to remove it.\n3. Extension — deeper, not more of the same. No busywork.\n4. What the teacher watches for to decide who needs which, in the first 10 minutes\n5. How this is arranged so nobody is publicly labelled\n\nRules:\n- Same objective for all three. Differentiate the route, not the destination.\n- Extension must be harder thinking, not extra questions",
      "variables": [
        {
          "name": "context",
          "description": "Background the model needs",
          "example": "we shipped late twice this quarter",
          "required": true
        },
        {
          "name": "learning_objective",
          "description": "What learners should be able to do afterwards",
          "example": "balance simple redox equations",
          "required": true
        }
      ],
      "tags": [
        "teaching",
        "education",
        "training"
      ],
      "difficulty": "advanced"
    },
    {
      "id": "email-to-a-parent-about-a-problem",
      "title": "Email to a Parent About a Problem",
      "description": "Raise a concern without triggering defensiveness",